{
  "meta": {
    "title": "World Model Registry",
    "version": "2",
    "last_verified": "2026-10-20",
    "scope": "Tools that generate a navigable scene or world from text, images or video. Exportable: the tool hands you a file. Streamed only: the tool shows you a world and gives you no file. Object-level generators are listed by name and not covered.",
    "canonical_url": "https://rishsadh.com/world-model-registry",
    "json_url": "https://rishsadh.com/world-model-registry/registry.json",
    "schema_url": "https://rishsadh.com/world-model-registry/schema.json",
    "citation": "Rish Sadh, \"World Model Registry\", version 2, 2026-10-20. https://rishsadh.com/world-model-registry. DOI 10.5281/zenodo.22653071. Data CC BY 4.0.",
    "interested_party": "This registry is maintained by Rish Sadh, founder of Reidify, a design studio in Mumbai. It takes no money from any vendor listed, publishes no scores or rankings, and records only what vendors publish, quoted with dates.",
    "doi": "10.5281/zenodo.22653071"
  },
  "changes": [
    {
      "date": "2026-10-20",
      "entry_id": "marble",
      "field": "tiers[0].includes, Expand worlds to larger spaces",
      "was": "Expand worlds to larger spaces",
      "now": "Expand worlds to larger spaces (conflict: the pricing page lists this under Free, in the plan card and with a check in the Free column of its comparison table, read 2026-10-20; the billing docs list \"Expanding worlds to larger spaces\" under \"Pro plan\", \"Unlocks advanced workflows, including:\")",
      "source": "https://docs.worldlabs.ai/marble/support/account-billing.md",
      "read_on": "2026-10-20"
    },
    {
      "date": "2026-10-20",
      "entry_id": "worldsplat",
      "field": "tiers[0].includes[0], star count",
      "was": "Repository created 27 March 2026, last pushed 28 March 2026, 3 stars (GitHub API, read 29 September 2026)",
      "now": "Repository created 27 March 2026, last pushed 28 March 2026, 4 stars (GitHub API, read 20 October 2026)",
      "source": "https://api.github.com/repos/timscheuerai/worldsplat",
      "read_on": "2026-10-20"
    },
    {
      "date": "2026-10-20",
      "entry_id": "decart-oasis-3",
      "field": "notes, Mirage page",
      "was": "The Mirage page at decart.ai/mirage returned HTTP 404 on 3 September 2026; the homepage lists",
      "now": "The Mirage page at decart.ai/mirage returned HTTP 404 on 3 September 2026 and again on 20 October 2026, with and without www, and no replacement was found (the decart.ai homepage links to no Mirage page, the pages /lucy, /oasis and /blog and research.decart.ai do not mention it, and the Wayback Machine availability API returned no snapshot of the address on 20 October 2026); the homepage lists",
      "source": "https://decart.ai/",
      "read_on": "2026-10-20"
    },
    {
      "date": "2026-10-20",
      "entry_id": "decart-oasis-3",
      "field": "sources, Mirage page URL",
      "was": "https://www.decart.ai/mirage",
      "now": "removed: the address returns HTTP 404 and no replacement page exists; the 404 is recorded in notes",
      "source": "https://www.decart.ai/mirage",
      "read_on": "2026-10-20"
    },
    {
      "date": "2026-10-20",
      "entry_id": "lingbot-world",
      "field": "why_no_export, GPU count",
      "was": "generate.py writes video; the examples run on eight GPUs. No 3D scene representation is produced.",
      "now": "generate.py writes video; the 14B examples run on eight GPUs and the 1.3B example on four. No 3D scene representation is produced.",
      "source": "https://github.com/Robbyant/lingbot-world-v2",
      "read_on": "2026-10-20"
    },
    {
      "date": "2026-10-20",
      "entry_id": "marble",
      "field": "outputs, High-quality mesh GLB, detail",
      "was": "One glb around 600k triangles with texture information; another glb around 1M triangles with vertex colors. Takes up to an hour to generate. Rate limited to 4 generation requests per hour per user. Typically 100-200 MB",
      "now": "One glb around 600k triangles with texture information; another glb around 1M triangles with vertex colors. Takes up to an hour to generate. Rate limited to 4 generation requests per hour per user. Typically 100-200 MB. The export specs page states \"You can only generate high quality mesh on worlds you own\"",
      "source": "https://docs.worldlabs.ai/marble/export/specs.md",
      "read_on": "2026-10-20"
    },
    {
      "date": "2026-09-30",
      "entry_id": "marble",
      "field": "sources, export page URL",
      "was": "https://docs.worldlabs.ai/marble/export.md",
      "now": "https://docs.worldlabs.ai/marble/export/gaussian-splat.md (the old URL now redirects here; same content)",
      "source": "https://docs.worldlabs.ai/marble/export/gaussian-splat.md",
      "read_on": "2026-09-30"
    },
    {
      "date": "2026-09-30",
      "entry_id": "beeble-3d-scene-generator",
      "field": "sources, pricing page URL",
      "was": "https://www.beeble.ai/pricing",
      "now": "https://beeble.ai/pricing-cloud (the old URL now redirects here; the listed prices and credits are unchanged)",
      "source": "https://beeble.ai/pricing-cloud",
      "read_on": "2026-09-30"
    },
    {
      "date": "2026-09-30",
      "entry_id": "runway-gwm-worlds",
      "field": "contact_route value",
      "was": "Runway help centre ticket, from Getting Help with your Runway Account",
      "now": "In-app help: an AI assistant that escalates to a person, per Getting Help with your Runway Account",
      "source": "https://help.runwayml.com/hc/en-us/articles/20821762056723",
      "read_on": "2026-09-30"
    },
    {
      "date": "2026-09-29",
      "entry_id": "marble",
      "field": "commercial_rights (Standard), quote, opening clause of 3.3(b)",
      "was": "Paid Account Users own all rights, title, and interest in and to Outputs generated through their use of the Services, ex ...",
      "now": "Subject to the terms, conditions, and limitations of this TOS, Paid Account Users own all rights, title, and interest in and to Outputs generated through their use of the Services, ex ...",
      "source": "https://www.worldlabs.ai/terms-of-service",
      "read_on": "2026-09-29"
    },
    {
      "date": "2026-09-29",
      "entry_id": "marble",
      "field": "commercial_rights (Pro and Max), quote, opening clause of 3.3(b)",
      "was": "Paid Account Users own all rights, title, and interest in and to Outputs generated through their use of the Services, ex ...",
      "now": "Subject to the terms, conditions, and limitations of this TOS, Paid Account Users own all rights, title, and interest in and to Outputs generated through their use of the Services, ex ...",
      "source": "https://www.worldlabs.ai/terms-of-service",
      "read_on": "2026-09-29"
    },
    {
      "date": "2026-09-29",
      "entry_id": "marble",
      "field": "notes, release cadence and ownership",
      "was": "Models selectable on 8 September 2026: Marble 1.0 Draft, Marble 1.0, Marble 1.1, Marble 1.1 Plus; the docs recommend Marble 1.1. The release notes page still ends at 2 April 2026, five months with no published release note, while World Labs launched Atlas on 1 September 2026. Atlas is early access with select partners and World Labs states it will power future versions of Marble.",
      "now": "Models selectable on 29 September 2026: Marble 1.0 Draft, Marble 1.0, Marble 1.1, Marble 1.1 Plus; the docs recommend Marble 1.1. The release notes page still ends at 2 April 2026, with no published release note since, while World Labs launched Atlas on 1 September 2026 (early access with select partners; the post states it will power future versions of Marble). On 28 September 2026 AMD announced a definitive agreement to acquire World Labs, expected to close by the end of 2026 subject to regulatory approvals; on 29 September 2026 the Terms of Service (last updated January 21, 2026) and the pricing pages did not mention AMD.",
      "source": "https://docs.worldlabs.ai/marble/release-notes.md",
      "read_on": "2026-09-29"
    },
    {
      "date": "2026-09-29",
      "entry_id": "marble",
      "field": "notes, AMD acquisition",
      "was": "not recorded",
      "now": "AMD announced a definitive agreement to acquire World Labs on 2026-09-28, expected to close by the end of 2026 subject to regulatory approvals. The Terms of Service last-updated date is still January 21, 2026 and the pricing pages do not mention AMD.",
      "source": "https://ir.amd.com/news-events/press-releases/detail/1299/amd-to-acquire-world-labs-to-advance-the-future-of-ai-compute",
      "read_on": "2026-09-29"
    },
    {
      "date": "2026-09-29",
      "entry_id": "hunyuanworld-1-0",
      "field": "tiers[1].includes[0], hosted demo page state",
      "was": "Page returned no readable content to the fetcher and showed only a loading spinner in a browser on 3 September 2026",
      "now": "Page returned no readable content to the fetcher and showed only a loading spinner in a browser on 3 September 2026; on 29 September 2026 the page redirected to a login page with the text \"登录后开启3D创作之旅\" and showed no price or plan",
      "source": "https://3d.hunyuan.tencent.com/sceneTo3D",
      "read_on": "2026-09-29"
    },
    {
      "date": "2026-09-29",
      "entry_id": "hy-world-2-0",
      "field": "tiers[1].includes[2], hosted product page state",
      "was": "Page showed only a loading spinner in a browser on 3 September 2026",
      "now": "Page showed only a loading spinner in a browser on 3 September 2026; on 29 September 2026 the page redirected to a login page with the text \"登录后开启3D创作之旅\" and showed no price or plan",
      "source": "https://3d.hunyuan.tencent.com/sceneTo3D",
      "read_on": "2026-09-29"
    },
    {
      "date": "2026-09-29",
      "entry_id": "hy-world-1-5-worldplay",
      "field": "price, hosted demo page state",